Questions,Answers
What is a novel coronavirus?,A novel coronavirus is a new coronavirus that has not been previously identified.
What is COVID-19?,COVID-19 is the disease caused by the novel coronavirus SARS-CoV-2.
What are the symptoms of COVID-19?,"Common symptoms include fever, cough, and difficulty breathing."
How does COVID-19 spread?,COVID-19 spreads mainly through respiratory droplets when an infected person coughs or sneezes.
How can I protect myself from COVID-19?,"Wash hands frequently, wear a mask, practice social distancing, and get vaccinated."
